{
  "_links": {
    "fractions": {
      "href": "/epaye/840%2FMODES17/fractions"
    },
    "declarations": {
      "href": "/epaye/840%2FMODES17/declarations"
    },
    "employment-check": {
      "href": "/epaye/840%2FMODES17/employed/{nino}"
    },
    "self": {
      "href": "/epaye/840%2FMODES17"
    }
  },
  "empref": "840/MODES17",
  "employer": {
    "name": {
      "nameLine1": "KILL-JOY PLC THE FUNERAL",
      "nameLine2": "COMPANY"
    },
    "address": {
      "addressLine1": "Foreign Address Line 1",
      "addressLine2": "Foreign Address Line 2",
      "addressLine3": "Foreign Address Line 3",
      "addressLine4": "Foreign Address Line 4",
      "addressLine5": "Foreign Address Line 5",
      "foreignCountry": "France"
    },
    "contact": {
      "telephone": {},
      "email": {}
    }
  },
  "communication": {
    "name": {
      "nameLine1": "KILL-JOY PLC THE FUNERAL",
      "nameLine2": "COMPANY"
    },
    "address": {
      "addressLine1": "Foreign Address Line 1",
      "addressLine2": "Foreign Address Line 2",
      "addressLine3": "Foreign Address Line 3",
      "addressLine4": "Foreign Address Line 4",
      "addressLine5": "Foreign Address Line 5",
      "foreignCountry": "France"
    },
    "contact": {
      "telephone": {},
      "email": {}
    }
  }
}